{
  "schema_version": 1,
  "kind": "pap-experiment-record",
  "experiment_id": "PAP-20260715-RUNTIME-BOUNDARY-E2E",
  "title": "P17 runtime-boundary consolidation regression gate",
  "recorded_at": "2026-07-15",
  "hypothesis": "Moving PAP runner state into one integration adapter, exposing one Attention runtime facade, and splitting KV models, IPC, observability, and handoff preserves the accepted P17 behavior and performance.",
  "evidence": "formal-clean",
  "decision": "accepted",
  "validity": {
    "status": "valid",
    "reasons": []
  },
  "baseline": {
    "status": "not-applicable",
    "description": "The independently registered PAP-20260715-MODEL-ADAPTER-E2E record supplies the comparison values; registry ownership keeps that run with its original experiment.",
    "run_ids": []
  },
  "treatment": {
    "status": "present",
    "description": "Three clean P17 repetitions after consolidating runner, Attention-service, and KV lifecycle boundaries and making late tokens for known released session handles idempotent.",
    "run_ids": [
      "20260715_7f732f5be_p17_runtime_boundary_formal"
    ]
  },
  "primary_variable": {
    "name": "runtime_boundary",
    "baseline": "model_adapter_only",
    "treatment": "runner_attention_kv_boundaries"
  },
  "run_ids": [
    "20260715_7f732f5be_p17_runtime_boundary_formal"
  ],
  "aggregation_method": "Pooled request-level samples across three repetitions per run; median comparison with a 5% regression threshold.",
  "metrics": [
    {
      "name": "ttft_ms",
      "scope": "round_1",
      "statistic": "median",
      "unit": "ms",
      "baseline_value": 10528.011343500111,
      "treatment_value": 10533.330389502225,
      "direction": "lower-is-better"
    },
    {
      "name": "tpot_ms",
      "scope": "round_1",
      "statistic": "median",
      "unit": "ms",
      "baseline_value": 39.231980954897224,
      "treatment_value": 39.15545689410018,
      "direction": "lower-is-better"
    },
    {
      "name": "ttft_ms",
      "scope": "steady_rounds_2_5",
      "statistic": "median",
      "unit": "ms",
      "baseline_value": 203.37082199694123,
      "treatment_value": 212.13672000158112,
      "direction": "lower-is-better"
    },
    {
      "name": "tpot_ms",
      "scope": "steady_rounds_2_5",
      "statistic": "median",
      "unit": "ms",
      "baseline_value": 50.348064986282424,
      "treatment_value": 50.24471884512333,
      "direction": "lower-is-better"
    }
  ],
  "conclusion": "The first attempt at 3b2ddd4b6 stopped in repetition 2 when session deletion raced a queued asynchronous sampled-token batch. Commit 7f732f5be records bounded released-handle tombstones while retaining 404 for never-seen IDs. Its three clean repetitions completed 60 of 60 requests and passed all correctness audits. Relative changes versus 003029a77 were +0.05% R1 TTFT, -0.20% R1 TPOT, +4.31% steady TTFT, and -0.21% steady TPOT; all passed the 5% regression gate. xPAyP and cross-host NIXL remain preserved-unverified.",
  "supersedes": [],
  "superseded_by": null,
  "raw_artifacts": [
    {
      "name": "aggregate",
      "path": {
        "root_id": "pap-worktree",
        "relative_path": "test/baseline/pap/results/runs/20260715_7f732f5be_p17_runtime_boundary_formal/aggregate.json"
      },
      "sha256": "6324b7ac9108ecb14186aa2fc8caf50b44e280fb59b5e40db1e2e52e3a82e738"
    },
    {
      "name": "rep1_result",
      "path": {
        "root_id": "pap-worktree",
        "relative_path": "test/baseline/pap/results/runs/20260715_7f732f5be_p17_runtime_boundary_formal/rep1/result.json"
      },
      "sha256": "8867f5c16d65e9b683ce0644ddc049509d4604424cc6c69528e2becceb61e208"
    },
    {
      "name": "rep2_result",
      "path": {
        "root_id": "pap-worktree",
        "relative_path": "test/baseline/pap/results/runs/20260715_7f732f5be_p17_runtime_boundary_formal/rep2/result.json"
      },
      "sha256": "7892b4998a8a23f2258a266074f002a1a2fbef7a4997dc2500bc3d4102f7f596"
    },
    {
      "name": "rep3_result",
      "path": {
        "root_id": "pap-worktree",
        "relative_path": "test/baseline/pap/results/runs/20260715_7f732f5be_p17_runtime_boundary_formal/rep3/result.json"
      },
      "sha256": "133ec30e875d9c758324d40c47be4806e79126445647f0d5d23e28ad229aa5dd"
    }
  ],
  "tags": [
    "p17",
    "runtime-boundary",
    "lifecycle",
    "regression-gate",
    "1pa1p",
    "local-fast"
  ]
}
